{
  "$schema": "./live-sources.schema.json",
  "schemaVersion": 1,
  "registryUpdated": "2026-10-15",
  "about": "Sources investigated for the live evidence page (/live) in Experiment 003. Every entry was checked by AI agents opening official pages and, where possible, making a small number of requests, on 15 October 2026. No entry has yet been checked by a human (verification.humanVerified is false throughout). Quotes in verification.evidence are copied from the pages named. See docs/LIVE_EVIDENCE.md and docs/DATA_SOURCES.md.",
  "sources": [
    {
      "id": "nasa-firms",
      "name": "NASA FIRMS active fire detections (VIIRS 375 m, NOAA-20 and NOAA-21)",
      "institution": "NASA, Fire Information for Resource Management System (FIRMS), part of LANCE",
      "jurisdiction": "global",
      "category": "satellite-fire-observations",
      "recordType": "observation",
      "officialUrl": "https://firms.modaps.eosdis.nasa.gov/",
      "documentationUrls": [
        "https://firms.modaps.eosdis.nasa.gov/active_fire/",
        "https://firms.modaps.eosdis.nasa.gov/api/area/",
        "https://firms.modaps.eosdis.nasa.gov/api/map_key/",
        "https://www.earthdata.nasa.gov/data/tools/firms/faq",
        "https://www.earthdata.nasa.gov/data/tools/firms/active-fire-data-attributes-modis-viirs",
        "https://www.earthdata.nasa.gov/data/tools/firms"
      ],
      "accessMethod": "file-download",
      "dataFormat": "CSV",
      "endpoints": [
        {
          "url": "https://firms.modaps.eosdis.nasa.gov/data/active_fire/noaa-20-viirs-c2/csv/J1_VIIRS_C2_SouthEast_Asia_24h.csv",
          "description": "Default (no key): NASA's openly downloadable “South East Asia, last 24 hours” VIIRS file for NOAA-20. About 2 MB on 15 October 2026."
        },
        {
          "url": "https://firms.modaps.eosdis.nasa.gov/data/active_fire/noaa-21-viirs-c2/csv/J2_VIIRS_C2_SouthEast_Asia_24h.csv",
          "description": "Default (no key): the same file for NOAA-21."
        },
        {
          "url": "https://firms.modaps.eosdis.nasa.gov/api/area/csv/{MAP_KEY}/VIIRS_NOAA20_NRT/95,-6.5,119.5,7.5/2",
          "description": "With a MAP_KEY: the documented area API, for the map window and the last two UTC days; the site keeps the 24 hours before retrieval. The same request is made for VIIRS_NOAA21_NRT."
        }
      ],
      "authenticationRequired": false,
      "authentication": {
        "type": "api-key-optional",
        "envVar": "NASA_FIRMS_MAP_KEY",
        "howToObtain": "https://firms.modaps.eosdis.nasa.gov/api/map_key/",
        "notes": "Not needed: the regional files are openly downloadable. A free MAP_KEY, requested by a person with an email address, switches the site to the documented area API. It is read only on the server and never stored in the repository."
      },
      "rateLimits": "Area API: “MAP_KEY limit is 5000 transactions / 10-minute interval.” No limit is stated for the regional files.",
      "updateFrequency": "FIRMS FAQ: the CSV files for the last 24 hours, 48 hours and 7 days “are updated every 60 minutes”.",
      "latency": "FIRMS FAQ: “FIRMS makes the NRT data available within 3 hours of a satellite observation (on a best-effort basis)”.",
      "historicalAvailability": "These files hold only recent detections. FIRMS's archive tools reach back further (NOAA-20 from 1 April 2018 and NOAA-21 from 17 January 2024, per the Active Fire Data page; the FAQ gives 1 January 2020 for NOAA-20). Near-real-time records are later replaced by standard-processing records (after about 2–3 months, possibly up to 5).",
      "status": "AVAILABLE",
      "integration": "integrated",
      "licence": {
        "name": "No licence named for these products; NASA asks redistributors to cite FIRMS and to link its data use guidance and disclaimer",
        "url": "https://www.earthdata.nasa.gov/data/tools/firms"
      },
      "attribution": "We acknowledge the use of data and/or imagery from NASA's Fire Information for Resource Management System (FIRMS) (https://earthdata.nasa.gov/firms), part of NASA's Land, Atmosphere Near real-time Capability for Earth observations (LANCE) (https://earthdata.nasa.gov/lance) and NASA's Earth Science Data and Information System (ESDIS). Data: VIIRS 375 m near-real-time active fire detections from NOAA-20 (doi:10.5067/FIRMS/VIIRS/VJ114IMGT_NRT.002) and NOAA-21.",
      "freshness": {
        "basis": "observedAt",
        "recentMaxMinutes": 960,
        "staleAfterMinutes": 1800,
        "rationale": "Measured from the newest detection in NASA's files. FIRMS says polar-orbiting sensors such as VIIRS typically view the same area twice daily, with full global coverage every 12 hours. It aims to publish near-real-time detections within 3 hours of an overpass, on a best-effort basis (a gap of about 4 hours was observed), and rewrites the files about hourly. So the newest detection can be up to about 16 hours old even when the feed is current. Beyond 30 hours, at least one full overpass cycle has been missed."
      },
      "fields": [
        {
          "name": "latitude, longitude",
          "meaning": "Centre of the satellite pixel in which the algorithm flagged one or more fires or other thermal anomalies; not necessarily the location of the fire itself.",
          "unit": "decimal degrees"
        },
        {
          "name": "acq_date, acq_time",
          "meaning": "Date and time of the satellite overpass (acq_time as HHMM).",
          "unit": "UTC"
        },
        {
          "name": "confidence",
          "meaning": "Detection confidence class: low, nominal or high. FIRMS advises using it with caution.",
          "unit": "class"
        },
        {
          "name": "frp",
          "meaning": "Pixel-integrated fire radiative power.",
          "unit": "MW"
        },
        {
          "name": "bright_ti4, bright_ti5",
          "meaning": "Brightness temperature of the pixel in two VIIRS channels.",
          "unit": "K"
        },
        {
          "name": "satellite, version, daynight",
          "meaning": "Satellite (N20 or N21), product version (e.g. 2.0NRT), and day or night overpass."
        }
      ],
      "canShow": [
        "Where and when the VIIRS instruments on NOAA-20 and NOAA-21 detected thermal anomalies — usually fires — in the map window, with NASA's confidence class.",
        "How many detections there were, and where they cluster, in NASA's latest 24-hour files."
      ],
      "cannotShow": [
        "That any detection is a vegetation fire: “Different types of thermal anomalies are not currently attributed in the NRT MODIS or VIIRS data”; gas flares, volcanoes and industrial heat can also be detected.",
        "Exactly where a fire is, or how big: FIRMS says “We are not able to determine the exact location or size of the fire”.",
        "Fires the satellites missed: between overpasses, under cloud, heavy smoke or tree canopy, or too small or cool to detect. The files contain no information on cloud cover or missing data.",
        "How many fires there were: one fire can produce many detections.",
        "Who started a fire, why, who owns or manages the land, or whether any law was broken.",
        "Whether smoke from a detected fire reached Malaysia, Singapore or anywhere else."
      ],
      "limitations": [
        "Each detection is the centre of a pixel about 375 m across (larger towards the edge of a scan); the fire may be anywhere in it. FIRMS adds that near-real-time position errors are usually under 100 m but can be several kilometres.",
        "NASA labels these files “24h”, but they are not a strict rolling 24 hours: they can include detections more than a day old. The page shows the actual range of acquisition times.",
        "Suomi NPP is not used: NOAA and NASA announced that delivery of its data ends on 2 November 2026 at 13:00 UTC (a date NASA says is subject to change; older FIRMS text says 1 November).",
        "Detections include persistent heat sources such as gas flares and industrial plants. FIRMS marks experimental “static thermal anomaly” areas on its Fire Map, but that layer is “not available for distribution”, so this site does not filter them out.",
        "The files' Last-Modified time shows when NASA's server last rewrote a file. That happens about hourly, often with unchanged content, so it is not the time of the newest detection.",
        "FIRMS lists days with missing satellite data on a separate page, and records instrument problems on its outage page (for example, a NOAA-21 anomaly in July 2026). This site does not check either automatically: a gap in NASA's data shows here only as ageing data.",
        "NASA's disclaimer: the designations in the data “do not imply the expression of any opinion whatsoever … concerning the delimitation of its frontiers or boundaries”.",
        "NASA's earthdata.nasa.gov pages (FAQ, attribute table) refused automated requests from the research network on 15 October 2026; their wording was read from Internet Archive copies dated 27 August to 12 October 2026.",
        "The regional files are a download convenience; FIRMS documents the area API, which needs a MAP_KEY, for programmatic queries. FIRMS's own outage notice points users to these regional files.",
        "No licence is named for these products. NASA's data use guidance says data from NASA-led missions are licensed as CC0 unless marked otherwise, and that non-NASA data follow the arrangements of the sponsoring organisation; it does not say which applies to VIIRS detections from NOAA's satellites. NASA's product records list no use constraints. NASA material must not be used to suggest NASA's endorsement."
      ],
      "verification": {
        "checkedOn": "2026-10-15",
        "checkedBy": "AI agents (Claude Code), Experiment 003: a researcher and a separate sceptic",